{
  "schemaVersion": "clawguard.sopPack.v1",
  "id": "small-business/toy-shop/daily-close",
  "title": "Toy Shop Daily Close Checklist",
  "industry": "toy-shop",
  "role": "store-manager",
  "description": "Checks whether an AI-assisted toy shop daily close has the product safety, recall, warning-label, return, cash, and manager approval evidence needed before the store is marked closed.",
  "sources": [
    {
      "label": "CPSC Recalls and Product Safety Warnings",
      "url": "https://www.cpsc.gov/Recalls"
    },
    {
      "label": "CPSC Tracking Label Business Guidance",
      "url": "https://www.cpsc.gov/Business--Manufacturing/Business-Education/tracking-label"
    },
    {
      "label": "CPSC Stop Online Sale of Recalled Products",
      "url": "https://www.cpsc.gov/Business--Manufacturing/Business-Education/ResaleThrift-Stores-Information-Center/Stop-Online-Sale-of-Recalled-Products"
    },
    {
      "label": "FTC Advertising and Marketing Basics",
      "url": "https://www.ftc.gov/business-guidance/advertising-marketing/advertising-marketing-basics"
    }
  ],
  "evidence": [
    {
      "id": "recall-check-log",
      "title": "Recall check log completed",
      "severity": "high",
      "aliases": [
        "recallCheckLog"
      ],
      "recommendation": "Record recall checks for new, returned, or questionable products before they are sold or returned to shelf."
    },
    {
      "id": "age-warning-label-check",
      "title": "Age and warning labels checked",
      "severity": "high",
      "aliases": [
        "ageWarningLabelCheck"
      ],
      "recommendation": "Confirm age grading, choking hazard, battery, magnet, and other warning labels are present and readable where applicable."
    },
    {
      "id": "damaged-packaging-log",
      "title": "Damaged packaging log completed",
      "severity": "medium",
      "aliases": [
        "damagedPackagingLog"
      ],
      "recommendation": "Record damaged packaging, missing labels, exposed batteries, broken parts, or opened returns before close."
    },
    {
      "id": "return-and-refund-log-reviewed",
      "title": "Return and refund log reviewed",
      "severity": "medium",
      "aliases": [
        "returnRefundLogReviewed"
      ],
      "recommendation": "Review returns, refunds, exchanges, safety complaints, and customer notes before closing."
    },
    {
      "id": "safety-complaint-log-reviewed",
      "title": "Safety complaint log reviewed",
      "severity": "high",
      "aliases": [
        "safetyComplaintLogReviewed"
      ],
      "recommendation": "Escalate choking, battery, magnet, chemical, injury, or recall-related complaints to a manager."
    },
    {
      "id": "display-and-floor-safety-check",
      "title": "Display and floor safety check completed",
      "severity": "medium",
      "aliases": [
        "displayFloorSafetyCheck"
      ],
      "recommendation": "Confirm displays, shelves, aisles, demo toys, cords, and loose parts are safe before close."
    },
    {
      "id": "cash-reconciliation",
      "title": "Cash drawer reconciliation completed",
      "severity": "medium",
      "aliases": [
        "cashReconciliation"
      ],
      "recommendation": "Reconcile register totals, refunds, gift cards, discounts, and deposit before closing."
    },
    {
      "id": "restricted-access-stock-check",
      "title": "Restricted or high-risk stock secured",
      "severity": "medium",
      "aliases": [
        "restrictedAccessStockCheck"
      ],
      "recommendation": "Secure high-value items, small parts, batteries, magnets, demo electronics, and backroom stock."
    }
  ],
  "approvals": [
    {
      "id": "manager-signoff",
      "title": "Manager sign-off recorded",
      "severity": "high",
      "aliases": [
        "managerSignoff"
      ],
      "recommendation": "A manager or owner must sign off before the agent marks the toy shop daily close complete."
    }
  ],
  "thresholds": [
    {
      "id": "cash-variance",
      "title": "Cash variance exceeds toy shop threshold",
      "field": "metrics.cashVarianceUsd",
      "max": 5,
      "severity": "medium",
      "decision": "manual_review",
      "recommendation": "Escalate cash variance above $5 to a manager before closing."
    },
    {
      "id": "safety-complaint-count",
      "title": "Safety complaint count requires manager review",
      "field": "metrics.safetyComplaintCount",
      "max": 0,
      "severity": "high",
      "decision": "manual_review",
      "recommendation": "Any toy safety complaint should be reviewed by a manager before close."
    }
  ],
  "blockedActions": [
    {
      "id": "complete-close-without-manager-signoff",
      "title": "Toy shop daily close cannot be marked complete without manager sign-off",
      "action": "complete_close",
      "whenMissing": [
        "manager-signoff"
      ],
      "severity": "high",
      "reason": "The workflow is trying to complete the toy shop daily close without the required manager approval.",
      "recommendation": "Pause the close, request manager sign-off, then rerun the SOP check."
    },
    {
      "id": "sell-recalled-product",
      "title": "Recalled product sale is blocked",
      "action": "sell_recalled_product",
      "severity": "critical",
      "reason": "The workflow attempts to sell, list, or return a recalled product to shelf.",
      "recommendation": "Stop the sale, remove the product from inventory, and follow recall instructions."
    },
    {
      "id": "sell-product-with-missing-warning-label",
      "title": "Missing warning-label sale is blocked",
      "action": "sell_product_with_missing_warning_label",
      "severity": "critical",
      "reason": "The workflow attempts to sell a children's product with missing or unreadable safety labeling.",
      "recommendation": "Hold the product for manager review and supplier verification."
    },
    {
      "id": "close-with-open-safety-complaint",
      "title": "Close with open safety complaint is blocked",
      "action": "complete_close",
      "whenThreshold": [
        "safety-complaint-count"
      ],
      "severity": "high",
      "reason": "The workflow is trying to close while safety complaints still need manager review.",
      "recommendation": "Review and record the safety complaint disposition before closing."
    }
  ]
}
